,number,value,datetime_start,datetime_complete,duration,params_batch_size,params_buffer_size,params_exploration_final_eps,params_exploration_fraction,params_gamma,params_learning_rate,params_learning_starts,params_lr_schedule,params_net_arch,params_subsample_steps,params_target_update_interval,params_train_freq,state
99,99,66.69291313793511,2022-08-10 05:25:28.581213,2022-08-10 05:31:48.806983,0 days 00:06:20.225770,128,1000000,0.13399457797624703,0.05850007021411929,0.995,6.482470784351397e-05,0,constant,large,1,1000,16,PRUNED
