,number,value,datetime_start,datetime_complete,duration,params_batch_size,params_buffer_size,params_exploration_final_eps,params_exploration_fraction,params_gamma,params_learning_rate,params_learning_starts,params_lr_schedule,params_net_arch,params_subsample_steps,params_target_update_interval,params_train_freq,state
0,0,25.00000037252903,2022-08-09 18:11:51.476693,2022-08-09 18:12:16.677278,0 days 00:00:25.200585,128,10000,0.028268129265670974,0.1995505753535754,0.98,0.3577712363617005,5000,linear,small,8,10000,16,COMPLETE
1,1,5.954173249937594,2022-08-09 18:12:16.693972,2022-08-09 18:15:06.204059,0 days 00:02:49.510087,64,50000,0.18054714204960942,0.16169924514841794,0.9999,0.003775005589310565,1000,linear,large,2,15000,4,PRUNED
2,2,78.22557129245251,2022-08-09 18:15:06.207993,2022-08-09 18:17:17.757832,0 days 00:02:11.549839,128,1000000,0.04495902789017634,0.3019451488636532,0.98,0.00027520975965890214,1000,linear,small,1,5000,8,COMPLETE
3,3,-499.0,2022-08-09 18:17:17.769508,2022-08-09 18:17:30.574459,0 days 00:00:12.804951,256,100000,0.020571312747043914,0.06499763424327243,0.95,0.0014629465841212242,20000,constant,medium,4,10000,128,PRUNED
4,4,25.00000037252903,2022-08-09 18:17:30.578340,2022-08-09 18:25:35.166881,0 days 00:08:04.588541,512,50000,0.05366152137733398,0.18127072389399873,0.98,0.8479322722391772,5000,constant,large,2,15000,1,PRUNED
5,5,-499.0,2022-08-09 18:25:35.170926,2022-08-09 18:25:49.264273,0 days 00:00:14.093347,512,10000,0.015873697292308475,0.23987562112746286,0.9999,0.00034100721773419807,20000,linear,medium,2,5000,256,PRUNED
6,6,-499.0,2022-08-09 18:25:49.268367,2022-08-09 18:26:01.815529,0 days 00:00:12.547162,256,100000,0.03318589534958729,0.2647147110433733,0.95,0.01663545715919028,20000,linear,large,2,15000,8,PRUNED
7,7,-499.0,2022-08-09 18:26:01.819572,2022-08-09 18:26:16.035222,0 days 00:00:14.215650,256,50000,0.08546328410532661,0.32737102742267576,0.999,5.714678296375293e-05,10000,linear,medium,2,1000,8,PRUNED
8,8,-20.202993343770505,2022-08-09 18:26:16.039190,2022-08-09 18:30:43.461608,0 days 00:04:27.422418,512,1000000,0.09743538604144722,0.29941881125967806,0.98,0.002678357359345444,5000,constant,medium,1,15000,128,PRUNED
9,9,25.00000037252903,2022-08-09 18:30:43.465748,2022-08-09 18:31:32.092740,0 days 00:00:48.626992,16,10000,0.15777739397878443,0.16376104572622552,0.99,0.9158411032113307,5000,linear,medium,1,1000,4,PRUNED
10,10,-21.88432508148253,2022-08-09 18:31:32.096805,2022-08-09 18:32:30.826042,0 days 00:00:58.729237,32,1000000,0.13609029375150777,0.4622221333179925,0.9,1.833478678815371e-05,1000,constant,small,1,1,8,PRUNED
11,11,25.00000037252903,2022-08-09 18:32:30.829998,2022-08-09 18:33:05.328376,0 days 00:00:34.498378,128,1000000,0.06115285126180942,0.38806161554720975,0.98,0.06270445128018193,0,linear,small,8,20000,16,PRUNED
12,12,25.00000037252903,2022-08-09 18:33:05.332389,2022-08-09 18:33:39.250319,0 days 00:00:33.917930,128,10000,0.0021627218719657837,0.03149819066588025,0.995,0.09695387709071786,1000,linear,small,8,5000,16,PRUNED
13,13,-499.0,2022-08-09 18:33:39.254246,2022-08-09 18:33:52.563683,0 days 00:00:13.309437,100,1000000,0.058612171818311104,0.3853404591902031,0.98,0.0002943642235397637,10000,linear,small,8,10000,1000,PRUNED
14,14,42.83671044372022,2022-08-09 18:33:52.567735,2022-08-09 18:35:00.259351,0 days 00:01:07.691616,128,10000,0.12033226803996377,0.09232985877714506,0.98,0.00024062898216495923,0,linear,small,4,5000,16,PRUNED
15,15,-254.43743528258057,2022-08-09 18:35:00.263346,2022-08-09 18:36:00.809313,0 days 00:01:00.545967,128,10000,0.040640278168615644,0.21586691407186354,0.995,0.016244222744748467,5000,linear,small,1,10000,1000,PRUNED
16,16,25.00000037252903,2022-08-09 18:36:00.813145,2022-08-09 18:36:39.377417,0 days 00:00:38.564272,128,1000000,0.07844180018908424,0.3361439174867864,0.999,0.12120218255358241,1000,linear,small,8,1,256,PRUNED
17,17,25.00000037252903,2022-08-09 18:36:39.381229,2022-08-09 18:37:18.195901,0 days 00:00:38.814672,64,100000,0.008477493123920668,0.11631658173622798,0.99,4.827715677388398e-05,5000,linear,small,1,20000,1,PRUNED
18,18,65.34492191504687,2022-08-09 18:37:18.199802,2022-08-09 18:38:09.806504,0 days 00:00:51.606702,16,10000,0.1152731509751796,0.4728149430499471,0.98,0.0006190078479713458,1000,constant,small,8,10000,8,COMPLETE
19,19,41.06729190945625,2022-08-09 18:38:09.817328,2022-08-09 18:39:18.817666,0 days 00:01:09.000338,16,1000000,0.11507886061126764,0.4838199941034445,0.9,0.0008657289714200646,1000,constant,small,4,5000,8,PRUNED
20,20,-296.26196000296625,2022-08-09 18:39:18.822634,2022-08-09 18:40:25.853603,0 days 00:01:07.030969,16,1000000,0.14948553007095167,0.42602920196947724,0.98,8.966555561215966e-05,1000,constant,large,8,10000,8,PRUNED
21,21,43.20978881455958,2022-08-09 18:40:25.857950,2022-08-09 18:41:31.734987,0 days 00:01:05.877037,32,10000,0.07755312642512233,0.39068073475730647,0.98,0.008654267389697134,1000,constant,small,8,10000,16,PRUNED
22,22,6.451650536619127,2022-08-09 18:41:31.738991,2022-08-09 18:42:46.667777,0 days 00:01:14.928786,100,10000,0.03820113066044184,0.271042235441454,0.98,0.0007492970391185448,1000,constant,small,8,10000,8,PRUNED
23,23,-499.0,2022-08-09 18:42:46.671696,2022-08-09 18:42:59.373364,0 days 00:00:12.701668,16,10000,0.11320172932666818,0.34792493148087306,0.98,0.0001268745347605275,10000,constant,small,8,10000,8,PRUNED
24,24,54.84890941213816,2022-08-09 18:42:59.377236,2022-08-09 18:44:36.323104,0 days 00:01:36.945868,128,10000,0.1943029128456667,0.21160973113723613,0.98,2.4746028274965627e-05,0,linear,small,1,5000,16,PRUNED
25,25,25.00000037252903,2022-08-09 18:44:36.327002,2022-08-09 18:45:03.530336,0 days 00:00:27.203334,128,10000,0.09714715303050911,0.4324423246246676,0.98,0.317363999681005,5000,linear,small,8,10000,8,PRUNED
26,26,25.00000037252903,2022-08-09 18:45:03.534384,2022-08-09 18:45:50.041681,0 days 00:00:46.507297,16,50000,0.06587403596944548,0.11804310210699848,0.9,0.005291296532142869,1000,constant,small,8,1000,1000,PRUNED
27,27,28.252345395833252,2022-08-09 18:45:50.045570,2022-08-09 18:47:56.732132,0 days 00:02:06.686562,128,100000,0.026060770654590178,0.2986076944602649,0.995,0.0005574830171563924,1000,linear,small,1,20000,128,PRUNED
28,28,-499.0,2022-08-09 18:47:56.736327,2022-08-09 18:48:25.744092,0 days 00:00:29.007765,100,10000,0.04563634284121674,0.4962510282804569,0.95,0.0017990084516264504,5000,constant,small,8,1,4,PRUNED
29,29,66.46040582042187,2022-08-09 18:48:25.748226,2022-08-09 18:50:10.392518,0 days 00:01:44.644292,64,50000,0.16365825521266186,0.18397001292889845,0.9999,0.0001473841821446124,1000,linear,large,4,5000,256,COMPLETE
30,30,57.92779332250357,2022-08-09 18:50:10.405883,2022-08-09 18:51:51.108331,0 days 00:01:40.702448,64,50000,0.16860051168007847,0.14457127992995783,0.9999,0.00015098586526721537,1000,linear,large,4,5000,256,PRUNED
31,31,65.90676869992167,2022-08-09 18:51:51.112243,2022-08-09 18:53:47.285273,0 days 00:01:56.173030,64,50000,0.17968137307261894,0.20816396958678512,0.9999,0.00041827740161386233,1000,linear,large,4,5000,256,COMPLETE
32,32,74.29939953852445,2022-08-09 18:53:47.296835,2022-08-09 18:55:50.898899,0 days 00:02:03.602064,64,50000,0.19520950041252844,0.20317872455352082,0.9999,0.0003896693643497189,1000,linear,large,4,5000,256,COMPLETE
33,33,58.09491921570152,2022-08-09 18:55:50.912346,2022-08-09 18:57:29.587657,0 days 00:01:38.675311,64,50000,0.1862432422594425,0.22924545670567098,0.9999,4.687599507958753e-05,1000,linear,large,4,5000,256,PRUNED
34,34,72.23022394049913,2022-08-09 18:57:29.591991,2022-08-09 18:59:29.146977,0 days 00:01:59.554986,64,50000,0.17353196760160625,0.18940385909174567,0.9999,0.0013242303946141903,1000,linear,large,4,5000,256,COMPLETE
35,35,22.321601850539444,2022-08-09 18:59:29.161542,2022-08-09 19:01:23.193436,0 days 00:01:54.031894,64,50000,0.19919075414774098,0.17441277688767068,0.9999,0.0013257043868096638,1000,linear,large,4,5000,256,PRUNED
36,36,-499.0,2022-08-09 19:01:23.197646,2022-08-09 19:01:36.299243,0 days 00:00:13.101597,64,50000,0.17016565872930928,0.25175890702023285,0.9999,0.00014027202960266303,20000,linear,large,4,5000,256,PRUNED
37,37,25.00000037252903,2022-08-09 19:01:36.303334,2022-08-09 19:02:49.689016,0 days 00:01:13.385682,64,50000,0.1398774730337859,0.13848487795074516,0.9999,1.1888004038224508e-05,1000,linear,large,4,5000,256,PRUNED
38,38,-499.0,2022-08-09 19:02:49.693173,2022-08-09 19:03:03.771844,0 days 00:00:14.078671,64,50000,0.16684014071822084,0.19177824723953255,0.9999,0.0022011207599656186,20000,linear,large,4,5000,256,PRUNED
39,39,-178.10251280311496,2022-08-09 19:03:03.775963,2022-08-09 19:07:06.215522,0 days 00:04:02.439559,64,50000,0.1818338286082787,0.2812992128087347,0.9999,0.005637336994822474,1000,linear,large,4,5000,1,PRUNED
40,40,-499.0,2022-08-09 19:07:06.219460,2022-08-09 19:07:20.559679,0 days 00:00:14.340219,256,50000,0.1512839201011857,0.24194375500399298,0.999,0.00023560495946886576,10000,linear,large,2,15000,256,PRUNED
41,41,63.43265092372894,2022-08-09 19:07:20.563717,2022-08-09 19:09:17.955997,0 days 00:01:57.392280,64,50000,0.18947478927791536,0.19377935733975804,0.9999,0.0004065350679957763,1000,linear,large,4,5000,256,PRUNED
42,42,1.8527971513569355,2022-08-09 19:09:17.960597,2022-08-09 19:11:14.314833,0 days 00:01:56.354236,64,50000,0.17661739948266003,0.1626740876160673,0.9999,0.0013065139205428334,1000,linear,large,4,5000,256,PRUNED
43,43,56.69088531192392,2022-08-09 19:11:14.319351,2022-08-09 19:16:11.175851,0 days 00:04:56.856500,512,50000,0.17732368926239397,0.2211040010204857,0.9999,0.0004050450678364775,1000,linear,large,4,5000,256,PRUNED
44,44,9.808399508334697,2022-08-09 19:16:11.181815,2022-08-09 19:17:21.050833,0 days 00:01:09.869018,64,50000,0.15910690535944433,0.2916417133075415,0.9999,6.384358674958984e-05,1000,linear,medium,4,5000,4,PRUNED
45,45,56.6330225225538,2022-08-09 19:17:21.054911,2022-08-09 19:19:05.569371,0 days 00:01:44.514460,32,50000,0.13162134440770684,0.3194524124952597,0.95,0.00019280219087287317,0,linear,large,4,1000,128,PRUNED
46,46,-109.20293732360005,2022-08-09 19:19:05.573944,2022-08-09 19:21:45.253253,0 days 00:02:39.679309,64,100000,0.1610509825202764,0.24924087604809,0.99,0.003253568907538389,1000,linear,large,2,5000,256,PRUNED
47,47,-499.0,2022-08-09 19:21:45.257400,2022-08-09 19:21:58.588902,0 days 00:00:13.331502,256,1000000,0.19928524498248248,0.08739332148245853,0.9999,0.001070364592710495,20000,linear,medium,4,15000,256,PRUNED
48,48,84.75144153926522,2022-08-09 19:21:58.593221,2022-08-09 19:37:16.110536,0 days 00:15:17.517315,512,50000,0.14344421200852078,0.17981096052256482,0.9999,3.084428010809778e-05,1000,linear,large,1,5000,1,COMPLETE
49,49,-499.0,2022-08-09 19:37:16.123430,2022-08-09 19:37:47.152353,0 days 00:00:31.028923,512,1000000,0.14422557272693032,0.14197261962764343,0.999,2.5085910920080822e-05,10000,linear,large,1,1,1,PRUNED
50,50,84.46130906231701,2022-08-09 19:37:47.156244,2022-08-09 19:53:15.229533,0 days 00:15:28.073289,512,50000,0.13198275483711208,0.023853894361713424,0.9999,7.516684687367262e-05,1000,linear,large,1,5000,1,COMPLETE
51,51,80.15987135618926,2022-08-09 19:53:15.242273,2022-08-09 20:08:43.724523,0 days 00:15:28.482250,512,50000,0.12358249462392656,0.0066718943916970475,0.9999,8.62687777145972e-05,1000,linear,large,1,5000,1,COMPLETE
52,52,67.85335326064379,2022-08-09 20:08:43.737774,2022-08-09 20:24:22.798801,0 days 00:15:39.061027,512,50000,0.12383738354167985,0.0014906879274593776,0.9999,3.876079022116365e-05,1000,linear,large,1,5000,1,PRUNED
53,53,46.402753193862736,2022-08-09 20:24:22.803192,2022-08-09 20:39:12.058180,0 days 00:14:49.254988,512,50000,0.10661827383982772,0.03171848399995772,0.9999,1.1493203824220012e-05,1000,linear,large,1,5000,1,PRUNED
54,54,87.707559732534,2022-08-09 20:39:12.062233,2022-08-09 20:54:45.038439,0 days 00:15:32.976206,512,50000,0.12933119390391912,0.051134116569252513,0.99,7.825239952941631e-05,1000,linear,large,1,20000,1,COMPLETE
55,55,31.497830384410918,2022-08-09 20:54:45.052764,2022-08-09 21:02:55.647389,0 days 00:08:10.594625,512,1000000,0.1254383600889515,0.049037827387734545,0.99,7.563457361267223e-05,1000,linear,medium,1,20000,1,PRUNED
56,56,46.93133681770414,2022-08-09 21:02:55.652788,2022-08-09 21:20:32.201644,0 days 00:17:36.548856,512,100000,0.08925388845897378,0.006070705734361499,0.99,3.2103002071736555e-05,0,linear,large,1,20000,1,PRUNED
57,57,68.42687355615199,2022-08-09 21:20:32.208203,2022-08-09 21:36:54.168474,0 days 00:16:21.960271,512,50000,0.1324097211208349,0.06095930721623868,0.99,8.093769284191988e-05,1000,linear,large,1,20000,1,PRUNED
58,58,77.69923289380968,2022-08-09 21:36:54.173790,2022-08-09 21:53:19.408909,0 days 00:16:25.235119,512,1000000,0.10865661325228422,0.08657969638700931,0.995,0.00010191815435107711,1000,linear,large,1,20000,1,COMPLETE
59,59,93.25123101677745,2022-08-09 21:53:19.422802,2022-08-09 22:08:39.519712,0 days 00:15:20.096910,512,1000000,0.10949883414398862,0.022604589884911947,0.995,1.7558719999445275e-05,1000,linear,large,1,20000,1,COMPLETE
60,60,-499.0,2022-08-09 22:08:39.532968,2022-08-09 22:08:56.269318,0 days 00:00:16.736350,512,1000000,0.10308006584378963,0.027188787169419776,0.995,1.8724632068351752e-05,20000,linear,medium,1,20000,1,PRUNED
61,61,75.45001013558358,2022-08-09 22:08:56.273929,2022-08-09 22:24:30.213927,0 days 00:15:33.939998,512,1000000,0.10893911222134328,0.09656240995529776,0.995,0.00010241557397823941,1000,linear,large,1,20000,1,PRUNED
62,62,81.94386347290128,2022-08-09 22:24:30.218781,2022-08-09 22:39:56.944794,0 days 00:15:26.726013,512,1000000,0.09245456271795062,0.07445697625844097,0.995,2.0567527313601016e-05,1000,linear,large,1,20000,1,COMPLETE
63,63,79.81131812091917,2022-08-09 22:39:56.959949,2022-08-09 22:55:15.081322,0 days 00:15:18.121373,512,1000000,0.09240737592035049,0.018602306173575188,0.995,2.016298881625414e-05,1000,linear,large,1,20000,1,COMPLETE
64,64,62.59382947906852,2022-08-09 22:55:15.096906,2022-08-09 23:10:31.253238,0 days 00:15:16.156332,512,1000000,0.09114306806061648,0.025266442469484382,0.995,1.7404553266970525e-05,1000,linear,large,1,20000,1,PRUNED
65,65,53.30201904531568,2022-08-09 23:10:31.257340,2022-08-09 23:25:57.568238,0 days 00:15:26.310898,512,1000000,0.07800824711072316,0.047338908204028404,0.995,3.0306947920959067e-05,1000,linear,large,1,20000,1,PRUNED
66,66,69.0538498185575,2022-08-09 23:25:57.572842,2022-08-09 23:47:02.045844,0 days 00:21:04.473002,512,1000000,0.11981902935292159,0.0675886690304813,0.995,1.9367886469962556e-05,1000,linear,large,1,20000,1,PRUNED
67,67,61.22657287158072,2022-08-09 23:47:02.049890,2022-08-09 23:55:43.749072,0 days 00:08:41.699182,512,1000000,0.07049801692401655,0.021693553888093617,0.995,5.442576992382471e-05,5000,linear,large,1,20000,1,PRUNED
68,68,-499.0,2022-08-09 23:55:43.753428,2022-08-09 23:55:58.913628,0 days 00:00:15.160200,512,1000000,0.09670852648486021,0.06946962377583903,0.9,1.0711579318322292e-05,10000,linear,large,1,20000,1,PRUNED
69,69,98.14449657052755,2022-08-09 23:55:58.918009,2022-08-10 00:11:37.790526,0 days 00:15:38.872517,512,1000000,0.12728962049503378,0.04886491672731704,0.995,3.865454149963949e-05,1000,constant,large,1,20000,1,COMPLETE
70,70,-11.286454697139561,2022-08-10 00:11:37.805781,2022-08-10 00:26:39.412269,0 days 00:15:01.606488,512,100000,0.12761707734955408,0.11067054961672138,0.995,4.2277527256769985e-05,0,constant,large,1,1000,1000,PRUNED
71,71,86.4061350401491,2022-08-10 00:26:39.417350,2022-08-10 00:41:55.519746,0 days 00:15:16.102396,512,1000000,0.13855740244225453,0.011725379610985414,0.995,1.3815749822565001e-05,1000,constant,large,1,20000,1,COMPLETE
72,72,86.41960746943951,2022-08-10 00:41:55.532618,2022-08-10 00:57:16.618821,0 days 00:15:21.086203,512,1000000,0.13879560641110572,0.046959761546968015,0.995,1.5041152408482214e-05,1000,constant,large,1,20000,1,COMPLETE
73,73,88.28253894783556,2022-08-10 00:57:16.631763,2022-08-10 01:12:35.179994,0 days 00:15:18.548231,512,1000000,0.15133523505253704,0.04663853923557204,0.995,1.47570028114713e-05,1000,constant,large,1,20000,1,COMPLETE
74,74,-1.2678753647953271,2022-08-10 01:12:35.193041,2022-08-10 01:17:44.078423,0 days 00:05:08.885382,100,1000000,0.14839148381442654,0.04581133138849948,0.995,1.505892883966046e-05,1000,constant,large,1,20000,1,PRUNED
75,75,91.72901318743826,2022-08-10 01:17:44.082354,2022-08-10 01:32:59.856219,0 days 00:15:15.773865,512,1000000,0.1393405050393594,0.05272203944349656,0.995,3.035710120521481e-05,1000,constant,large,1,20000,1,COMPLETE
76,76,90.7018288269639,2022-08-10 01:32:59.870071,2022-08-10 01:48:24.705148,0 days 00:15:24.835077,512,1000000,0.1403713239473917,0.05136460957505742,0.995,3.054510148031452e-05,1000,constant,large,1,20000,1,COMPLETE
77,77,15.176526993326842,2022-08-10 01:48:24.718404,2022-08-10 02:03:38.931708,0 days 00:15:14.213304,512,1000000,0.15449620655477136,0.04029474691962148,0.995,1.4072566748443747e-05,1000,constant,large,1,20000,128,PRUNED
78,78,-95.890032351017,2022-08-10 02:03:38.936066,2022-08-10 02:06:39.937151,0 days 00:03:01.001085,32,1000000,0.14099385071625212,0.06001471507399991,0.995,1.0076259363546412e-05,1000,constant,large,1,20000,4,PRUNED
79,79,-19.986545342206956,2022-08-10 02:06:39.941170,2022-08-10 02:11:21.761449,0 days 00:04:41.820279,512,1000000,0.1376487351577412,0.10797638842034062,0.995,2.6160378654334017e-05,5000,constant,large,2,20000,16,PRUNED
80,80,66.45076811891049,2022-08-10 02:11:21.765938,2022-08-10 02:26:40.351906,0 days 00:15:18.585968,512,1000000,0.14694918495456663,0.07833834417143512,0.995,3.963514633331366e-05,1000,constant,large,1,20000,1,PRUNED
81,81,94.16462765298783,2022-08-10 02:26:40.356115,2022-08-10 02:42:13.003617,0 days 00:15:32.647502,512,1000000,0.1539352858691444,0.05037225454843856,0.995,3.18825141278435e-05,1000,constant,large,1,20000,1,COMPLETE
82,82,72.03923952262849,2022-08-10 02:42:13.185891,2022-08-10 02:57:25.914919,0 days 00:15:12.729028,512,1000000,0.1545109821067128,0.05248936677748045,0.995,1.3394104315669449e-05,1000,constant,large,1,20000,1,PRUNED
83,83,79.05380144696683,2022-08-10 02:57:25.918977,2022-08-10 03:12:55.500909,0 days 00:15:29.581932,512,1000000,0.1349076119633227,0.03690003879305537,0.995,5.520163840861514e-05,1000,constant,large,1,20000,1,PRUNED
84,84,87.12358518242836,2022-08-10 03:12:55.505058,2022-08-10 03:28:23.170976,0 days 00:15:27.665918,512,1000000,0.11779282663331268,0.012579290735464125,0.995,3.4484296933275674e-05,1000,constant,large,1,20000,1,COMPLETE
85,85,-9.058221007697284,2022-08-10 03:28:23.183840,2022-08-10 03:32:48.127698,0 days 00:04:24.943858,100,1000000,0.11678338864323808,0.059644715329078106,0.95,3.77102599966165e-05,1000,constant,large,1,20000,1000,PRUNED
86,86,57.957596907764675,2022-08-10 03:32:48.131715,2022-08-10 03:42:05.522583,0 days 00:09:17.390868,256,1000000,0.11328113932264125,0.09838246734994834,0.995,6.246577744598593e-05,1000,constant,large,1,20000,1,PRUNED
87,87,25.00000037252903,2022-08-10 03:42:05.527328,2022-08-10 03:44:23.179281,0 days 00:02:17.651953,16,1000000,0.12993139710562013,0.08143174843888318,0.995,0.03932465687744007,1000,constant,large,1,20000,1,PRUNED
88,88,-499.0,2022-08-10 03:44:23.183341,2022-08-10 03:44:47.292392,0 days 00:00:24.109051,512,1000000,0.11955426457560905,0.12557219367775024,0.995,2.533179372469093e-05,20000,constant,medium,1,1,1,PRUNED
89,89,-499.0,2022-08-10 03:44:47.296579,2022-08-10 03:45:02.401183,0 days 00:00:15.104604,512,1000000,0.16421948605703324,0.0359896004345257,0.99,4.551031282442878e-05,10000,constant,large,2,15000,1,PRUNED
90,90,30.500222085043788,2022-08-10 03:45:02.405443,2022-08-10 04:00:29.782061,0 days 00:15:27.376618,512,1000000,0.15317213239284663,0.018467730112824612,0.9,3.273913050854285e-05,1000,constant,large,1,20000,1,PRUNED
91,91,87.00865900609642,2022-08-10 04:00:29.786314,2022-08-10 04:15:53.677642,0 days 00:15:23.891328,512,1000000,0.13835829642177755,0.01754330940682831,0.995,1.3659641014352017e-05,1000,constant,large,1,20000,1,COMPLETE
92,92,14.960912065207959,2022-08-10 04:15:53.690801,2022-08-10 04:31:26.139079,0 days 00:15:32.448278,512,1000000,0.14331701355296564,0.00038006434184637006,0.995,2.1381154390861262e-05,1000,constant,large,1,20000,1,PRUNED
93,93,71.43676899354905,2022-08-10 04:31:26.143270,2022-08-10 04:34:46.930114,0 days 00:03:20.786844,32,1000000,0.13677778140207875,0.05458151459060161,0.995,1.5280197965135908e-05,1000,constant,large,1,20000,1,PRUNED
94,94,56.52742383852601,2022-08-10 04:34:46.934122,2022-08-10 04:50:18.057179,0 days 00:15:31.123057,512,1000000,0.14707253911680032,0.03775915727321364,0.999,2.442478741281703e-05,1000,constant,large,1,20000,4,PRUNED
95,95,18.449410295300186,2022-08-10 04:50:18.061258,2022-08-10 05:05:42.380754,0 days 00:15:24.319496,512,1000000,0.12640277373047173,0.015173024044836994,0.995,3.3096671548647694e-05,1000,constant,large,1,20000,128,PRUNED
96,96,93.89191984832287,2022-08-10 05:05:42.385113,2022-08-10 05:12:18.867229,0 days 00:06:36.482116,128,1000000,0.15862190656825184,0.06899298578494815,0.995,1.6057646047725468e-05,0,constant,large,1,20000,16,COMPLETE
97,97,85.30132915209978,2022-08-10 05:12:18.880192,2022-08-10 05:18:43.753775,0 days 00:06:24.873583,128,1000000,0.1582994757969472,0.07398717880984508,0.995,1.0235735097678898e-05,0,constant,large,1,20000,16,COMPLETE
98,98,55.489912503026424,2022-08-10 05:18:43.767400,2022-08-10 05:25:28.577114,0 days 00:06:44.809714,128,1000000,0.15101863964249765,0.028445061965906265,0.99,0.00011726689025489645,0,constant,large,1,20000,16,PRUNED
