,number,value,datetime_start,datetime_complete,duration,params_activation_fn,params_alpha,params_batch_size,params_beta,params_clip_range,params_ent_coef,params_gae_lambda,params_gamma,params_learning_rate,params_lr_schedule,params_max_grad_norm,params_n_epochs,params_n_steps,params_net_arch,params_vf_coef,state
0,0,0.0,2022-08-19 18:59:55.576807,2022-08-19 19:09:55.074504,0 days 00:09:59.497697,relu,0.6166726221093753,16,0.03238114152664562,0.4,2.4359235714478576e-08,0.8,0.9999,0.8578381202609855,constant,0.3,5,32,medium,0.777778208096534,COMPLETE
1,1,0.0,2022-08-19 19:09:55.111867,2022-08-19 19:18:18.699783,0 days 00:08:23.587916,relu,0.35003853700976717,512,0.83125436991601,0.2,2.2084324102520846e-06,0.92,0.98,1.6538611379036833e-05,constant,0.9,20,512,small,0.9195258649244783,COMPLETE
2,2,0.43508498796908085,2022-08-19 19:18:18.729156,2022-08-19 20:17:44.745918,0 days 00:59:26.016762,tanh,0.8690011793777341,512,0.05878121879429277,0.4,2.568503638288301e-07,0.8,0.995,7.300376518968603e-05,constant,0.7,20,8,medium,0.3999099105469852,COMPLETE
3,3,0.0,2022-08-19 20:17:44.771664,2022-08-19 20:21:55.834176,0 days 00:04:11.062512,tanh,0.7098318580165381,64,0.8938961555606091,0.4,0.021876065590754144,0.95,0.9,0.06810699397939167,linear,0.8,1,128,small,0.3077923334836714,COMPLETE
4,4,0.0,2022-08-19 20:21:55.858858,2022-08-19 20:29:27.924329,0 days 00:07:32.065471,relu,0.295250614010646,16,0.7367222103869703,0.3,1.2634670186138681e-06,1.0,0.995,0.0002877495805067496,linear,2.0,1,512,large,0.5993341590774964,COMPLETE
5,5,0.0,2022-08-19 20:29:27.954495,2022-08-19 20:37:33.835689,0 days 00:08:05.881194,relu,0.5623081278324645,512,0.4691937800928502,0.2,0.01567024857616661,0.92,0.95,0.0012829362030991884,constant,1.0,1,1024,small,0.7525584825355272,COMPLETE
6,6,0.0,2022-08-19 20:37:33.862317,2022-08-19 20:42:52.404140,0 days 00:05:18.541823,tanh,0.4083934274335058,512,0.08229697595638896,0.3,0.00015853927051871232,0.99,0.999,1.7442885352311382e-05,linear,0.8,1,1024,medium,0.275922372588953,COMPLETE
7,7,0.0,2022-08-19 20:42:52.431597,2022-08-19 21:07:35.886737,0 days 00:24:43.455140,relu,0.03306018782503173,256,0.5961264358087567,0.1,5.031181588092573e-06,0.99,0.95,0.012631430316896244,linear,0.8,10,16,medium,0.8256901403447151,COMPLETE
8,8,0.0,2022-08-19 21:07:35.915589,2022-08-19 21:16:18.509369,0 days 00:08:42.593780,relu,0.015770618238115208,32,0.9529902447675476,0.1,1.493885654457061e-05,1.0,0.98,0.0029906974905479023,linear,0.7,1,16,small,0.24442613248421008,COMPLETE
9,9,0.24119087728331423,2022-08-19 21:16:18.532814,2022-08-19 21:27:28.464386,0 days 00:11:09.931572,relu,0.8637371372829211,256,0.5546850347755461,0.2,1.6862603869503436e-06,0.8,0.95,0.005454518086184405,linear,0.8,5,256,small,0.052574001436252904,COMPLETE
10,10,0.2071840773095927,2022-08-19 21:27:28.493250,2022-08-19 22:34:56.174191,0 days 01:07:27.680941,tanh,0.9749833372761213,8,0.2701123112299181,0.4,1.096087587039222e-08,0.98,0.995,0.000166436746511661,constant,0.7,20,8,large,0.5316769163083943,COMPLETE
11,11,0.0,2022-08-19 22:34:56.204899,2022-08-19 22:37:22.653225,0 days 00:02:26.448326,tanh,0.9493874929685848,256,0.3733443389241328,0.2,1.8321596084145633e-07,0.8,0.99,0.023969225010163474,constant,0.6,5,256,medium,0.016063139202558918,COMPLETE
12,12,0.0041666666666666675,2022-08-19 22:37:22.683928,2022-08-19 22:46:41.692512,0 days 00:09:19.008584,tanh,0.7702806265352696,128,0.20308759710856442,0.2,2.519368795178935e-07,0.9,0.995,0.00021992845577897382,linear,0.5,5,2048,medium,0.027231840170178323,COMPLETE
13,13,0.4723049340337008,2022-08-19 22:46:41.716554,2022-08-19 23:00:59.492512,0 days 00:14:17.775958,tanh,0.8262438946732049,256,0.6123589178032648,0.4,0.0006535046705479189,0.8,0.95,0.0009838342753907682,constant,5.0,20,256,small,0.3981252666671693,COMPLETE
14,14,0.0,2022-08-19 23:00:59.524928,2022-08-20 00:10:43.068908,0 days 01:09:43.543980,tanh,0.7882940851448283,8,0.6713929672252085,0.4,0.0003123329554499668,0.8,0.9,0.00010646311571400297,constant,5.0,20,64,large,0.40858394735711234,COMPLETE
15,15,0.3970279851446149,2022-08-20 00:10:43.097595,2022-08-20 01:00:43.750427,0 days 00:50:00.652832,tanh,0.6698764863602346,32,0.3836368532286337,0.4,0.00156987367796481,0.8,0.99,4.604795763919546e-05,constant,5.0,20,8,small,0.43901148309092786,COMPLETE
16,16,0.0,2022-08-20 01:00:43.785388,2022-08-20 01:13:37.309731,0 days 00:12:53.524343,tanh,0.8732128567246613,128,0.17666749399487325,0.4,7.205171259497686e-05,0.9,0.999,0.0008988936379386271,constant,5.0,20,256,medium,0.6402174402414914,COMPLETE
17,17,0.0,2022-08-20 01:13:37.339689,2022-08-20 01:37:57.049078,0 days 00:24:19.709389,tanh,0.4738228431592209,64,0.44023673807317265,0.4,0.0018778761367978399,0.98,0.9999,0.000580900099821631,constant,0.7,10,8,small,0.16464412056419825,COMPLETE
18,18,0.05722553302577531,2022-08-20 01:37:57.074258,2022-08-20 01:47:57.425835,0 days 00:10:00.351577,tanh,0.19232850231563797,512,0.7611156028832197,0.4,0.09248750591194847,0.95,0.95,5.112194803303978e-05,constant,0.6,20,2048,medium,0.41402149400546884,COMPLETE
19,19,0.0,2022-08-20 01:47:57.460803,2022-08-20 01:55:36.177440,0 days 00:07:38.716637,tanh,0.8470929908309464,256,0.6526589028107752,0.1,0.0009844658394716538,0.8,0.995,0.14174304928872639,constant,1.0,20,128,large,0.1548958283977144,COMPLETE
20,20,0.39389316395803164,2022-08-20 01:55:36.210481,2022-08-20 02:17:35.839590,0 days 00:21:59.629109,tanh,0.5673115209708748,512,0.306918880760935,0.3,1.203553765322712e-07,0.8,0.95,0.0030340815953343726,constant,0.5,20,32,small,0.535469567638817,COMPLETE
21,21,0.4366743819422103,2022-08-20 02:17:35.868854,2022-08-20 03:08:03.231141,0 days 00:50:27.362287,tanh,0.6771553950587007,32,0.3676691049159769,0.4,0.0029469019498809465,0.8,0.99,4.549698581243337e-05,constant,5.0,20,8,small,0.4123071892180932,COMPLETE
22,22,0.48180272792047163,2022-08-20 03:08:03.256832,2022-08-20 03:58:59.107267,0 days 00:50:55.850435,tanh,0.7205619766282267,32,0.11251270969189897,0.4,0.005476799584661224,0.8,0.99,5.36602625841634e-05,constant,5.0,20,8,small,0.3612968486752713,COMPLETE
23,23,0.3567173281648278,2022-08-20 03:58:59.134290,2022-08-20 04:47:37.883204,0 days 00:48:38.748914,tanh,0.7147672185965427,32,0.1741194853312943,0.4,0.006517547826747171,0.8,0.99,1.458082635473626e-05,constant,5.0,20,8,small,0.32377805782380215,COMPLETE
24,24,0.3880348565908768,2022-08-20 04:47:37.913822,2022-08-20 05:04:00.707020,0 days 00:16:22.793198,tanh,0.641444687422291,32,0.563474144316841,0.4,0.005160699802869253,0.8,0.99,3.707231804838764e-05,constant,5.0,10,256,small,0.1906945034349892,COMPLETE
25,25,0.2655470064353057,2022-08-20 05:04:00.730646,2022-08-20 05:24:44.897931,0 days 00:20:44.167285,tanh,0.4995425225483312,32,0.36378837529250857,0.4,0.00035348451822359494,0.8,0.99,0.0004901559447520952,constant,5.0,20,64,small,0.6462726080702803,COMPLETE
26,26,0.0,2022-08-20 05:24:44.925428,2022-08-20 06:10:42.793046,0 days 00:45:57.867618,tanh,0.7766534186839917,32,0.5074824579588821,0.4,0.09840197312116689,0.92,0.99,0.0017671256517717052,constant,5.0,20,8,small,0.4734174739928756,PRUNED
27,27,0.35513748966132264,2022-08-20 06:10:42.806997,2022-08-20 06:58:04.919967,0 days 00:47:22.112970,tanh,0.7245659011360728,32,0.23873690646201084,0.4,2.6502031823142186e-05,0.98,0.99,1.033518401374087e-05,constant,0.9,20,8,small,0.3153572736324613,COMPLETE
28,28,0.33259615124120545,2022-08-20 06:58:04.954101,2022-08-20 07:10:01.202641,0 days 00:11:56.248540,tanh,0.5727262384639293,256,0.1061747164873992,0.1,0.0007677880950668628,0.9,0.99,0.0003325551828532977,constant,0.3,20,256,small,0.3579262556434132,COMPLETE
29,29,0.3406876460789504,2022-08-20 07:10:01.226133,2022-08-20 07:31:00.440713,0 days 00:20:59.214580,tanh,0.9186194414109309,16,0.03819534349188036,0.4,0.0034678777366294977,0.8,0.9999,0.00013013158987646326,constant,2.0,10,32,small,0.5067075508246122,COMPLETE
