,number,value,datetime_start,datetime_complete,duration,params_alpha,params_batch_size,params_beta,params_buffer_size,params_exploration_final_eps,params_exploration_fraction,params_gamma,params_learning_rate,params_learning_starts,params_lr_schedule,params_net_arch,params_subsample_steps,params_target_update_interval,params_train_freq,state
0,0,0.5484460694698355,2022-08-20 15:49:17.458656,2022-08-20 17:04:20.100498,0 days 01:15:02.641842,0.33093107549731327,512,0.898287522381096,50000,0.03357442570975962,0.11162554212383685,0.9999,2.2181069874186088e-05,5000,linear,medium,1,10000,1,COMPLETE
1,1,0.1405152224824356,2022-08-20 17:04:20.132619,2022-08-20 17:53:07.692195,0 days 00:48:47.559576,0.9220032421089167,100,0.8423084323987172,1000000,0.1201681579348979,0.012621438708061483,0.9999,0.0002715208758017026,20000,constant,medium,2,20000,16,PRUNED
2,2,0.13176470588235295,2022-08-20 17:53:07.700391,2022-08-20 18:59:15.232659,0 days 01:06:07.532268,0.77075308626554,64,0.3510022613414481,10000,0.01007545073512921,0.139400906603655,0.9999,4.364726364427135e-05,20000,linear,large,8,15000,4,PRUNED
3,3,0.0,2022-08-20 18:59:15.241626,2022-08-20 20:04:04.768648,0 days 01:04:49.527022,0.6139543160997988,100,0.27149918507741166,10000,0.012790748852521072,0.034007291963672304,0.9,0.01495458203913954,20000,constant,small,8,10000,1,PRUNED
4,4,0.0,2022-08-20 20:04:04.781808,2022-08-20 21:11:12.584589,0 days 01:07:07.802781,0.5604152739070654,128,0.4255631153481738,50000,0.002149802817825486,0.1919098920726181,0.999,1.262635022098645e-05,20000,linear,large,4,1000,8,PRUNED
5,5,0.0,2022-08-20 21:11:12.597066,2022-08-20 22:13:56.120824,0 days 01:02:43.523758,0.9040315653203002,256,0.3850974776919266,1000000,0.1992004727908105,0.28310900472317146,0.9,0.19135306922387119,5000,linear,large,2,15000,1,PRUNED
6,6,0.010025062656641605,2022-08-20 22:13:56.132248,2022-08-20 23:24:58.034853,0 days 01:11:01.902605,0.9621697153098108,64,0.6853055320265159,50000,0.025525030253960957,0.028983008368108798,0.9,1.157627581342245e-05,20000,constant,small,2,15000,4,PRUNED
7,7,0.5269016697588126,2022-08-20 23:24:58.050223,2022-08-21 00:13:26.798554,0 days 00:48:28.748331,0.22817974313452472,512,0.08628350219596348,50000,0.015118406434436626,0.08554283248463673,0.999,0.0021965597562048802,5000,constant,medium,2,20000,4,PRUNED
8,8,0.0,2022-08-21 00:13:26.808957,2022-08-21 00:38:40.249354,0 days 00:25:13.440397,0.7762249093895329,256,0.09946715558334829,1000000,0.19137624477891738,0.3088328812842879,0.995,0.0038170429880864556,0,linear,large,2,1000,16,PRUNED
9,9,0.5745062836624776,2022-08-21 00:38:40.258370,2022-08-21 01:42:57.625424,0 days 01:04:17.367054,0.3462015453698092,512,0.6108460908476072,1000000,0.19205293713089516,0.3082732837231717,0.999,1.8760313147295875e-05,10000,linear,small,2,20000,1,COMPLETE
10,10,0.15348837209302327,2022-08-21 01:42:57.651052,2022-08-21 02:19:29.650872,0 days 00:36:31.999820,0.079963706611207,32,0.616666171871654,100000,0.14345862413636326,0.455808052849426,0.99,0.0003016110066183882,10000,linear,small,4,1,1000,PRUNED
11,11,0.46718146718146725,2022-08-21 02:19:29.662782,2022-08-21 03:18:09.394735,0 days 00:58:39.731953,0.3296781709319275,512,0.9885365625011242,100000,0.08149720069121996,0.38357988646861246,0.95,0.00014839277646608065,1000,linear,medium,1,5000,256,PRUNED
12,12,0.5186567164179104,2022-08-21 03:18:09.406610,2022-08-21 04:26:24.388459,0 days 01:08:14.981849,0.37395642286285613,512,0.7363647972518991,1000000,0.06385817994890988,0.2113559012003026,0.98,6.608754394078549e-05,10000,linear,small,1,10000,128,PRUNED
13,13,0.41200000000000003,2022-08-21 04:26:24.397815,2022-08-21 05:22:21.831289,0 days 00:55:57.433474,0.01532700746276966,16,0.9488871797173013,50000,0.15881498930862337,0.34874609870149087,0.999,0.0014729848198135496,10000,linear,medium,1,20000,1,PRUNED
14,14,0.0,2022-08-21 05:22:21.841825,2022-08-21 06:31:31.035642,0 days 01:09:09.193817,0.42183457761366666,512,0.560409248124118,1000000,0.04648306697597381,0.14253011979035574,0.9999,0.4415409141044159,5000,linear,small,1,10000,1,PRUNED
15,15,0.6094570928196148,2022-08-21 06:31:31.050489,2022-08-21 07:36:38.734475,0 days 01:05:07.683986,0.1864439486281843,512,0.8135385320376795,50000,0.10558882208410521,0.42860934897504344,0.98,4.090444720111488e-05,0,linear,medium,1,5000,1,COMPLETE
16,16,0.0,2022-08-21 07:36:38.759787,2022-08-21 08:17:44.922562,0 days 00:41:06.162775,0.16797914894068355,16,0.775938740303628,100000,0.10909608252938015,0.4881884972123691,0.98,0.024414885495586725,0,linear,small,4,5000,128,PRUNED
17,17,0.0,2022-08-21 08:17:44.937904,2022-08-21 08:45:28.032333,0 days 00:27:43.094429,0.20419326972364263,32,0.5158149806562178,10000,0.15873729460725733,0.4136188127625779,0.98,0.0006914975064858624,0,linear,medium,8,5000,256,PRUNED
18,18,0.551094890510949,2022-08-21 08:45:28.042620,2022-08-21 09:32:47.856988,0 days 00:47:19.814368,0.48313421959816794,128,0.6611345669017696,50000,0.13086533792559416,0.3429653960935015,0.95,6.106496352295753e-05,1000,constant,medium,2,1,8,PRUNED
19,19,0.4789272030651341,2022-08-21 09:32:47.865834,2022-08-21 10:37:01.623400,0 days 01:04:13.757566,0.11853638823291207,512,0.8070514846430678,1000000,0.0913148444147384,0.4164190363219921,0.995,0.00012641214312434143,0,linear,small,1,5000,1000,PRUNED
20,20,0.4904942965779468,2022-08-21 10:37:01.634372,2022-08-21 11:36:21.413226,0 days 00:59:19.778854,0.25671227497328275,512,0.2573352588121174,50000,0.17725013727656289,0.2582872876112865,0.99,0.006741400452542868,10000,linear,small,2,20000,1,PRUNED
21,21,0.5457875457875458,2022-08-21 11:36:21.427477,2022-08-21 12:43:08.243817,0 days 01:06:46.816340,0.309995734309172,512,0.8721242346520337,50000,0.05010015580822576,0.2234461373265661,0.999,2.4571216807101195e-05,5000,linear,medium,1,10000,1,PRUNED
22,22,0.4701348747591522,2022-08-21 12:43:08.255234,2022-08-21 13:49:31.475634,0 days 01:06:23.220400,0.45008889850090894,512,0.9078000225771268,50000,0.0864460254093223,0.163712976560011,0.98,2.2781214507527634e-05,10000,linear,medium,1,10000,1,PRUNED
23,23,0.33542976939203356,2022-08-21 13:49:31.484119,2022-08-21 14:59:08.208960,0 days 01:09:36.724841,0.5804661745822386,512,0.7429950829563781,50000,0.071816064378081,0.09893426530915378,0.9999,1.0185180024786184e-05,5000,linear,medium,1,5000,1,PRUNED
24,24,0.0959232613908873,2022-08-21 14:59:08.221807,2022-08-21 15:46:15.077864,0 days 00:47:06.856057,0.27743473532917223,512,0.5816819808618527,50000,0.03677208534543111,0.30745555294498006,0.9999,0.000601306240022608,0,linear,medium,1,20000,1,PRUNED
25,25,0.0,2022-08-21 15:46:21.041815,2022-08-21 15:54:35.833183,0 days 00:08:14.791368,0.3813572272732593,512,0.8728007867494281,1000000,0.10515930281655292,0.37123027597563724,0.999,3.664400810493799e-05,1000,linear,medium,1,1,1,PRUNED
26,26,0.003346881348194092,2022-08-21 15:54:35.844245,2022-08-21 17:06:09.324528,0 days 01:11:33.480283,0.13878357813923953,64,0.9954740064855441,10000,0.14426152442377438,0.4402432510271238,0.98,0.00011242528598512086,0,linear,medium,8,1000,1,PRUNED
27,27,0.0,2022-08-21 17:06:09.337133,2022-08-21 17:43:34.899684,0 days 00:37:25.562551,0.5188592900078486,32,0.6834838171839221,100000,0.060512979382952664,0.25705773679587973,0.995,2.484972359004523e-05,10000,constant,large,4,5000,16,PRUNED
28,28,0.0,2022-08-21 17:43:34.908408,2022-08-21 19:56:36.694300,0 days 02:13:01.785892,0.0020652270851698185,128,0.45508921412889625,50000,0.1740022151038408,0.49704940924061736,0.99,0.05241331690689499,5000,linear,medium,1,10000,128,PRUNED
29,29,0.1420673677443363,2022-08-21 19:56:36.709324,2022-08-21 20:29:09.490677,0 days 00:32:32.781353,0.6646187430186576,100,0.8492256398268401,1000000,0.12209709568682871,0.0937456203259236,0.9999,0.0003533155749638944,5000,constant,small,2,20000,8,PRUNED
30,30,0.25145531289617346,2022-08-21 20:29:09.503087,2022-08-21 20:50:54.792098,0 days 00:21:45.289011,0.34557231278819606,256,0.8103604699117133,1000000,0.12526782004720716,0.32542331290495496,0.95,0.00015531559469667127,0,linear,medium,2,20000,256,PRUNED
31,31,0.07199443416356595,2022-08-21 20:50:54.804291,2022-08-21 21:24:53.407865,0 days 00:33:58.603574,0.4652433355372512,128,0.6588684211938903,50000,0.13855576566740047,0.3568303245240456,0.95,5.128934036406857e-05,1000,constant,medium,2,1,8,PRUNED
32,32,0.07326414209164751,2022-08-21 21:24:53.418880,2022-08-21 22:08:06.004798,0 days 00:43:12.585918,0.504793238329926,128,0.7216340851479622,50000,0.11061583703794516,0.40094598793105807,0.95,9.043718154249435e-05,1000,constant,medium,2,1,8,PRUNED
33,33,0.22442960934804188,2022-08-21 22:08:06.017822,2022-08-21 22:27:00.465793,0 days 00:18:54.447971,0.6842748255790214,128,0.6154139501602724,50000,0.09273232978503718,0.3404504745824077,0.95,4.592478628898818e-05,1000,constant,medium,2,1,8,PRUNED
34,34,0.0,2022-08-21 22:27:00.473970,2022-08-21 23:18:29.147049,0 days 00:51:28.673079,0.40878671506387576,100,0.5210278852428512,10000,0.1346693382032287,0.29224542937820064,0.9999,2.1663309206881497e-05,1000,constant,medium,8,1,1000,PRUNED
35,35,0.2774906610492856,2022-08-21 23:18:29.158709,2022-08-21 23:31:16.977708,0 days 00:12:47.818999,0.1967156330266966,128,0.776462404707592,50000,0.15847236397933703,0.27174348193725406,0.999,1.6666282400442402e-05,20000,constant,large,2,15000,8,PRUNED
36,36,0.533666902305138,2022-08-21 23:31:16.987187,2022-08-21 23:43:50.790655,0 days 00:12:33.803468,0.28251341010364134,512,0.9199777820776077,50000,0.1795508991418698,0.2244590921762052,0.9,6.9484407866026e-05,10000,constant,medium,2,10000,1,PRUNED
37,37,0.0014687801945883836,2022-08-21 23:43:50.800523,2022-08-22 00:07:53.246339,0 days 00:24:02.445816,0.09000009522139933,64,0.3309391207448165,50000,0.07731149867662403,0.006456803496818597,0.95,0.0007151000040541122,20000,constant,small,4,1000,4,PRUNED
38,38,0.010133480683171669,2022-08-22 00:07:53.255118,2022-08-22 00:21:35.004028,0 days 00:13:41.748910,0.47847989576776273,100,0.6504052321257379,10000,0.10055112005898634,0.1792392180910029,0.98,1.0222443738013186e-05,1000,linear,large,8,15000,16,PRUNED
39,39,0.0014258107088989441,2022-08-22 00:21:35.012250,2022-08-22 02:18:19.238852,0 days 01:56:44.226602,0.5485335774266727,16,0.4428260199801705,50000,0.19917743533724402,0.45191771243512224,0.999,0.0002591357885282808,5000,linear,medium,2,20000,1,PRUNED
40,40,0.40130352266042246,2022-08-22 02:18:19.254501,2022-08-22 02:35:35.456438,0 days 00:17:16.201937,0.863286720336812,256,0.7010850358594927,1000000,0.003868643070102932,0.04432628550517037,0.9,4.347790467797642e-05,0,constant,small,1,1,4,PRUNED
41,41,0.49350707700470126,2022-08-22 02:35:35.469428,2022-08-22 02:54:54.464863,0 days 00:19:18.995435,0.32564779205952127,512,0.8798284740432231,50000,0.04267393640800573,0.059536251467370335,0.999,2.8153854411399223e-05,5000,linear,medium,1,10000,1,PRUNED
42,42,0.5577204675245028,2022-08-22 02:54:54.481270,2022-08-22 03:08:14.487622,0 days 00:13:20.006352,0.2735677292652697,512,0.8300885562187321,50000,0.018321940923821563,0.22917631575923098,0.999,1.4826810275685959e-05,5000,linear,medium,1,10000,1,PRUNED
43,43,,2022-08-22 03:08:14.498781,,,0.23656363954105467,512,0.8141280549159016,50000,0.05713015365094583,0.11554013640214411,0.999,1.5743739035540777e-05,5000,linear,medium,1,10000,1,RUNNING
