,number,value,datetime_start,datetime_complete,duration,params_activation_fn,params_batch_size,params_clip_range,params_ent_coef,params_gae_lambda,params_gamma,params_learning_rate,params_lr_schedule,params_max_grad_norm,params_n_epochs,params_n_steps,params_net_arch,params_vf_coef,state
0,0,-499.0,2022-08-17 18:58:04.446311,2022-08-17 19:06:42.801147,0 days 00:08:38.354836,relu,8,0.4,2.3697303982568552e-07,0.9,0.9999,0.036413607699990365,constant,0.9,5,16,medium,0.5868395984488756,COMPLETE
1,1,25.00000037252903,2022-08-17 19:06:42.834138,2022-08-17 19:10:26.812996,0 days 00:03:43.978858,relu,64,0.3,0.004900217666311523,0.92,0.98,0.031411151753123055,linear,1.0,5,256,small,0.8166699268325259,COMPLETE
2,2,-499.0,2022-08-17 19:10:26.835266,2022-08-17 19:14:08.620666,0 days 00:03:41.785400,tanh,256,0.2,0.055859729403267645,0.95,0.999,0.002102235491173829,linear,0.8,10,64,medium,0.6451589922005293,PRUNED
3,3,25.00000037252903,2022-08-17 19:14:08.632504,2022-08-17 19:17:16.055875,0 days 00:03:07.423371,tanh,128,0.3,9.056534435442686e-07,0.8,0.9,0.00012160033136708323,constant,0.8,1,16,small,0.3498595037194352,COMPLETE
4,4,-499.0,2022-08-17 19:17:16.079615,2022-08-17 19:18:03.042080,0 days 00:00:46.962465,tanh,512,0.2,0.0006948475074264277,0.9,0.995,0.2887625917429704,linear,2.0,1,256,small,0.8929836081301403,PRUNED
5,5,-499.0,2022-08-17 19:18:03.056953,2022-08-17 19:28:07.537488,0 days 00:10:04.480535,relu,32,0.2,3.2568671647122306e-06,0.92,0.9999,0.3153941739774325,constant,5.0,20,256,large,0.7442996217526606,PRUNED
6,6,25.00000037252903,2022-08-17 19:28:07.551237,2022-08-17 19:38:40.788770,0 days 00:10:33.237533,relu,8,0.2,1.3603423116347238e-08,0.99,0.9,5.167380185330433e-05,constant,0.9,5,1024,medium,0.21936260553676667,COMPLETE
7,7,25.00000037252903,2022-08-17 19:38:40.815065,2022-08-17 19:54:38.626627,0 days 00:15:57.811562,relu,8,0.1,0.00018375195976018754,1.0,0.98,6.67355418763492e-05,linear,1.0,10,64,medium,0.04716323238227804,COMPLETE
8,8,-498.0,2022-08-17 19:54:38.648666,2022-08-17 19:58:31.474202,0 days 00:03:52.825536,relu,256,0.1,2.1523095952583142e-07,0.8,0.99,1.9622506350422077e-05,linear,0.6,20,512,small,0.5195723074278358,PRUNED
9,9,25.00000037252903,2022-08-17 19:58:31.484461,2022-08-17 20:04:41.207731,0 days 00:06:09.723270,relu,128,0.3,7.081714461432706e-05,0.99,0.995,0.4569276552580285,linear,0.3,20,64,medium,0.28544714202498755,COMPLETE
10,10,-370.4917183551937,2022-08-17 20:04:41.232499,2022-08-17 20:07:47.272842,0 days 00:03:06.040343,relu,64,0.3,0.02265119550214083,0.92,0.98,0.0077644667282924405,linear,1.0,5,2048,large,0.9841180476121797,PRUNED
11,11,36.630079567292704,2022-08-17 20:07:47.286340,2022-08-17 20:11:29.396217,0 days 00:03:42.109877,tanh,128,0.3,0.002714912154901436,0.8,0.9,0.0005519295268540798,constant,0.5,1,16,small,0.3995558065815194,COMPLETE
12,12,-49.550768774887544,2022-08-17 20:11:29.416258,2022-08-17 20:15:33.148724,0 days 00:04:03.732466,tanh,64,0.3,0.002742526727149511,0.98,0.95,0.000779146192076694,constant,0.5,1,8,small,0.7488764772714912,PRUNED
13,13,-498.0,2022-08-17 20:15:33.162677,2022-08-17 20:21:39.028846,0 days 00:06:05.866169,tanh,16,0.3,0.003410361816465008,0.92,0.98,0.032183106672958935,constant,0.5,5,128,small,0.4125402471011958,PRUNED
14,14,35.4462577143684,2022-08-17 20:21:39.042061,2022-08-17 20:25:08.733708,0 days 00:03:29.691647,tanh,64,0.4,1.4709818091151e-05,0.8,0.9,0.0006313386027065103,constant,0.7,1,32,small,0.1536241957258953,COMPLETE
15,15,25.00000037252903,2022-08-17 20:25:08.759936,2022-08-17 20:28:10.408587,0 days 00:03:01.648651,tanh,128,0.4,8.327545513697374e-06,0.8,0.9,0.00044257164293188845,constant,0.7,1,32,small,0.11605612331198281,COMPLETE
16,16,25.00000037252903,2022-08-17 20:28:10.431337,2022-08-17 20:31:31.295653,0 days 00:03:20.864316,tanh,16,0.4,2.6329101342971265e-05,0.8,0.9,0.00031135906149075074,constant,0.7,1,32,small,0.1612349877922097,COMPLETE
17,17,25.00000037252903,2022-08-17 20:31:31.321919,2022-08-17 20:33:40.285875,0 days 00:02:08.963956,tanh,512,0.4,0.0003191623689852693,0.8,0.9,0.0035826331034210586,constant,0.7,1,32,large,0.42612134266632123,COMPLETE
18,18,25.00000037252903,2022-08-17 20:33:40.318246,2022-08-17 20:36:54.693662,0 days 00:03:14.375416,tanh,32,0.4,1.9344472804234084e-05,0.98,0.99,0.0008659177602072062,constant,0.5,1,16,small,0.04668136130774497,COMPLETE
19,19,25.00000037252903,2022-08-17 20:36:54.721588,2022-08-17 20:40:04.336300,0 days 00:03:09.614712,tanh,64,0.1,0.0009205501411738283,0.95,0.95,1.0106734935406843e-05,constant,0.3,1,8,small,0.2657552076372359,COMPLETE
20,20,-499.0,2022-08-17 20:40:04.362753,2022-08-17 20:43:11.170855,0 days 00:03:06.808102,tanh,128,0.4,0.01723439320550994,1.0,0.999,0.0001660957611318291,constant,5.0,10,512,large,0.3641281920835977,PRUNED
21,21,25.00000037252903,2022-08-17 20:43:11.183444,2022-08-17 20:46:59.033946,0 days 00:03:47.850502,relu,64,0.3,0.005097801359596101,0.92,0.98,0.01707879889714858,linear,1.0,5,256,small,0.7917192870604328,COMPLETE
22,22,36.54590545224492,2022-08-17 20:46:59.060187,2022-08-17 20:50:59.992233,0 days 00:04:00.932046,tanh,64,0.3,0.09801555901614024,0.8,0.9,0.0029828371166856662,linear,2.0,5,128,small,0.49747121204342154,COMPLETE
23,23,25.00000037252903,2022-08-17 20:51:00.020420,2022-08-17 20:54:29.791264,0 days 00:03:29.770844,tanh,64,0.3,0.08746140491917867,0.8,0.9,0.0024691974652782584,linear,2.0,1,128,small,0.4993371352016347,COMPLETE
24,24,-313.11646722778676,2022-08-17 20:54:29.820149,2022-08-17 20:56:59.238082,0 days 00:02:29.417933,tanh,64,0.3,7.686462418124146e-05,0.8,0.9,0.0012567425572978898,constant,2.0,1,2048,small,0.6469263310096891,PRUNED
25,25,-499.0,2022-08-17 20:56:59.251207,2022-08-17 21:00:18.595080,0 days 00:03:19.343873,tanh,128,0.3,0.025864068494730576,0.8,0.9,0.007820342497296353,constant,0.6,5,128,small,0.536734793157954,PRUNED
26,26,40.72020825596992,2022-08-17 21:00:18.605979,2022-08-17 21:08:38.313725,0 days 00:08:19.707746,tanh,64,0.4,2.039142679306621e-06,0.8,0.9,0.00040886463457485376,linear,0.7,10,16,small,0.15429066376693154,COMPLETE
27,27,40.15083165892865,2022-08-17 21:08:38.340004,2022-08-17 21:17:00.895360,0 days 00:08:22.555356,tanh,32,0.1,3.21124456273787e-06,0.8,0.9,0.00023899042705447334,linear,0.5,10,16,small,0.3214516125190394,COMPLETE
28,28,38.34215607319493,2022-08-17 21:17:00.924386,2022-08-17 21:25:21.986069,0 days 00:08:21.061683,tanh,32,0.1,3.134793387053613e-06,0.8,0.9,0.00016453951694478418,linear,0.5,10,16,small,0.23434516261048194,COMPLETE
29,29,29.421091089956462,2022-08-17 21:25:22.011052,2022-08-17 21:35:01.832913,0 days 00:09:39.821861,tanh,32,0.1,1.192078777652729e-07,0.9,0.99,0.00020878815503215512,linear,0.5,10,16,large,0.22719567309735925,COMPLETE
30,30,-499.0,2022-08-17 21:35:01.855064,2022-08-17 21:42:33.205978,0 days 00:07:31.350914,tanh,32,0.1,1.1320486848437468e-06,0.99,0.9999,7.826417012220172e-05,linear,0.9,10,16,medium,0.31659897982563723,PRUNED
31,31,25.00000037252903,2022-08-17 21:42:33.218940,2022-08-17 21:50:33.149932,0 days 00:07:59.930992,tanh,32,0.1,3.2135469872902177e-06,0.8,0.9,3.2161962229157185e-05,linear,0.5,10,16,small,0.4329659501188994,COMPLETE
32,32,40.50423032882973,2022-08-17 21:50:33.179276,2022-08-17 21:59:05.562724,0 days 00:08:32.383448,tanh,32,0.1,8.80975275400497e-07,0.8,0.9,0.00019036846866252795,linear,0.5,10,16,small,0.2050224538994646,COMPLETE
33,33,-439.3599999576807,2022-08-17 21:59:05.589366,2022-08-17 22:05:02.771879,0 days 00:05:57.182513,tanh,32,0.1,6.167992973607821e-07,0.95,0.999,0.00026421347887944853,linear,0.5,10,16,small,0.13770767653665747,PRUNED
34,34,38.47952673225664,2022-08-17 22:05:02.786143,2022-08-17 22:13:18.155009,0 days 00:08:15.368866,tanh,32,0.1,5.9465085278773625e-08,0.8,0.9,7.10258384268561e-05,linear,0.5,10,16,small,0.21335939169842788,COMPLETE
35,35,25.00000037252903,2022-08-17 22:13:18.176551,2022-08-17 22:20:57.716048,0 days 00:07:39.539497,tanh,32,0.1,3.921600363794664e-08,0.9,0.995,3.100641650935219e-05,linear,0.5,10,16,small,0.010215757258129399,COMPLETE
36,36,-499.0,2022-08-17 22:20:57.739603,2022-08-17 22:22:47.161580,0 days 00:01:49.421977,tanh,256,0.1,7.610675995193975e-08,0.8,0.9999,0.1082395931344167,linear,0.8,10,1024,small,0.18777735505343118,PRUNED
37,37,36.522375570365696,2022-08-17 22:22:47.174936,2022-08-17 22:31:16.974310,0 days 00:08:29.799374,tanh,32,0.1,3.484677204430245e-07,0.98,0.9,9.660353774384889e-05,linear,0.7,10,16,small,0.10208863716332171,COMPLETE
38,38,31.278691972605884,2022-08-17 22:31:16.998818,2022-08-17 22:40:56.336542,0 days 00:09:39.337724,tanh,512,0.2,4.597581504598594e-08,1.0,0.95,5.06269388004948e-05,linear,5.0,10,16,medium,0.3226425780557899,COMPLETE
39,39,43.47121151785541,2022-08-17 22:40:56.357175,2022-08-17 22:53:59.375528,0 days 00:13:03.018353,tanh,8,0.1,1.3580057807548738e-06,0.8,0.9,0.0012721947464931303,linear,0.8,10,16,small,0.2665963705499098,COMPLETE
40,40,-171.14340259432794,2022-08-17 22:53:59.401525,2022-08-17 23:10:08.704542,0 days 00:16:09.303017,relu,8,0.1,1.5990745080838509e-06,0.95,0.999,0.001197481740534757,linear,0.8,10,1024,medium,0.07488818598399313,PRUNED
41,41,41.53173620831749,2022-08-17 23:10:08.715641,2022-08-17 23:23:21.671760,0 days 00:13:12.956119,tanh,8,0.1,1.0147337515666132e-08,0.8,0.9,0.00036381648857405983,linear,0.8,10,16,small,0.2787891916748316,COMPLETE
42,42,-1.8994225020811428,2022-08-17 23:23:21.697686,2022-08-17 23:36:38.014204,0 days 00:13:16.316518,tanh,8,0.1,3.8431773552919604e-07,0.8,0.9,0.0013527846539114535,linear,0.8,10,16,small,0.26955836589934906,PRUNED
43,43,,2022-08-17 23:36:38.025637,,,tanh,8,0.1,1.9136217333945843e-08,0.8,0.9,0.000384220592016564,linear,0.8,20,16,small,0.31394981403432054,RUNNING
